salary,companyName,jobCategory,contractType,jobTitle,location
"Nie podano Count: 1043","LPP S.A. Count: 478","Sprzedaż Count: 376","Umowa o pracę Count: 502","Telefoniczny Doradca Klienta Count: 77","Warszawa Count: 269"
"18zł Count: 5","CCIG Count: 196","Obsługa klienta Count: 244"," Count: 304","Specjalista ds. telefonicznej obsługi klienta Count: 15","Kraków Count: 115"
"2800zł Count: 4","Accenture Count: 115","Finanse Count: 193","Umowa zlecenie Count: 261","Specjalista ds. telefonicznych konsultacji Count: 10","Gdańsk Count: 87"
"5000 - 7000zł Count: 2","Testronic Count: 37","Języki obce Count: 106","Umowa o pracę, umowa zlecenie Count: 13","Specjalista ds. obsługi infolinii przychodzącej Count: 5","Wrocław Count: 63"
"31 - 34zł Count: 2","Deloitte Count: 26","IT i Programowanie Count: 43","Umowa B2B, umowa o pracę, umowa zlecenie Count: 3","Doradca Klienta Detalicznego Count: 5","Katowice Count: 60"
